{
  "contract_version": "calendar-monthly-selection/0.2.0-draft",
  "selection_id": "example-selection-2099-01-v1",
  "selection_version": 1,
  "supersedes_selection_id": null,
  "run_id": "2099-01-r99",
  "consumer_id": "calendar-renderer",
  "programme_month": "2099-01",
  "selected_activity_ids": [
    "example-activity-2099-01-001"
  ],
  "selection_subject_sha256": "7b0bf4d7d0604fa2252a3c794854b786083499c69258754029262508405093d9",
  "authority_purpose": "calendar-monthly-selection",
  "owner_authority": "example-programme-owner",
  "decision_reference": {
    "registry_id": "example-calendar-registry",
    "authority_id": "example-selection-authority-001"
  },
  "authority_artifact_sha256": "dddddddddddddddddddddddddddddddddddddddddddddddddddddddddddddddd",
  "decided_at": "2099-01-03T09:00:00Z"
}
